{
  "contract": "otc.mobile.table/1.0",
  "request_id": "req_cap_supported",
  "table_uri": "https://example.invalid/table/123",
  "capability": "otc.mobile.table/1.0",
  "read": {"support": "supported", "max_page_size": 100, "stable_record_ids": true},
  "record_update": {"support": "supported", "requires_expected_revision": true, "max_fields_per_patch": 10, "field_types": ["string", "integer", "number", "boolean", "date", "datetime"]},
  "limits": {"max_fields": 50, "max_patch_bytes": 16384},
  "source": {"connector_id": "reference", "connector_version": "0.1.0"}
}
