{
  "contract": "otc.mobile.table/1.0",
  "request_id": "req_cap_unknown",
  "table_uri": "https://example.invalid/table/123",
  "capability": "otc.mobile.table/1.0",
  "read": {"support": "supported", "max_page_size": 25, "stable_record_ids": false},
  "record_update": {"support": "unknown", "requires_expected_revision": true, "max_fields_per_patch": 0, "field_types": []},
  "limits": {"max_fields": 50, "max_patch_bytes": 16384},
  "source": {"connector_id": "sheet", "connector_version": "0.1.0"}
}
